{
  "formatVersion": 1,
  "id": "games.wavegames.uno",
  "version": "1.0.0",
  "title": {
    "en": "UNO",
    "ja": "UNO"
  },
  "description": {
    "en": "Race to empty your hand across scored rounds. Call UNO, challenge risky Wild Draw Fours, and be first to 500 points.",
    "ja": "ラウンドを重ねて手札をなくし、UNO宣言やワイルドドロー4へのチャレンジを駆使して500点を目指します。"
  },
  "icon": "assets/icon.svg",
  "engineApi": 1,
  "entrypoints": {
    "rules": "rules/index.mjs",
    "ui": "ui/index.html"
  },
  "orientation": "any",
  "capabilities": [],
  "modes": {
    "local": {
      "minPlayers": 2,
      "maxPlayers": 8
    },
    "wave": {
      "minPlayers": 2,
      "maxPlayers": 8,
      "pace": "turn-based"
    }
  }
}
