{
  "formatVersion": 1,
  "id": "games.wavegames.checkers",
  "version": "1.0.0",
  "title": {
    "en": "Checkers",
    "ja": "チェッカー"
  },
  "description": {
    "en": "American checkers with mandatory captures, multi-jumps, kings, and rematches.",
    "ja": "必須キャプチャ、連続ジャンプ、キング、再戦に対応したアメリカンチェッカーです。"
  },
  "icon": "assets/icon.svg",
  "engineApi": 1,
  "entrypoints": {
    "rules": "rules/index.mjs",
    "ui": "ui/index.html"
  },
  "orientation": "any",
  "capabilities": [],
  "modes": {
    "local": {
      "minPlayers": 2,
      "maxPlayers": 2
    },
    "wave": {
      "minPlayers": 2,
      "maxPlayers": 2,
      "pace": "turn-based"
    }
  }
}
