{
  "formatVersion": 1,
  "id": "games.wavegames.connect-four",
  "version": "1.1.0",
  "title": {
    "en": "Connect Four",
    "ja": "コネクトフォー"
  },
  "description": {
    "en": "Take turns dropping discs. Connect four horizontally, vertically, or diagonally to win.",
    "ja": "交互にディスクを落とし、縦・横・斜めのいずれかに4つ並べると勝ちです。"
  },
  "icon": "assets/icon.svg",
  "engineApi": 1,
  "entrypoints": {
    "rules": "rules/index.mjs",
    "ui": "ui/index.html"
  },
  "orientation": "any",
  "capabilities": [],
  "modes": {
    "local": {
      "minPlayers": 2,
      "maxPlayers": 2
    },
    "wave": {
      "minPlayers": 2,
      "maxPlayers": 2,
      "pace": "turn-based"
    }
  }
}
